Song;Author_band;Songwriters;Duration;Album;Album_type;No_on_album;Release_date;Link;Lyrics
The Day That Never Comes;Metallica;James Hetfield,Lars Ulrich,Kirk Hammett,Robert Trujillo;7:55;Death Magnetic;Album;4;2008-09-12;https://www.metallica.com/songs/the-day-that-never-comes.html;Born to push you around,Better just stay down,You pull away,He hits the flesh,You hit the ground, ,Mouth so full of lies,Tend to black your eyes,Just keep them closed,Keep praying,Just keep waiting, ,Waiting for the one,The day that never comes,When you stand up and feel the warmth,But the son shine never comes,No the son shine never comes, ,Push you cross that line,Just stay down this time,Hide in yourself,Crawl in yourself,You’ll have your time, ,God I’ll make them pay,Take it back one day,I’ll end this day,I’ll splatter color on this gray, ,Waiting for the one,The day that never comes,When you stand up and feel the warmth,But the son shine never comes, ,Love... is a four letter word,And never spoken here,Love... is a four letter word,Here in this prison, ,I suffer this no longer,I’ll put an end to this I swear,This I swear,The son will shine,This I swear,This I swear,This I swear!
Dead Kennedy Rolls;Metallica;James Hetfield,Lars Ulrich,Kirk Hammett,Bob Rock;;;;;;https://www.metallica.com/songs/dead-kennedy-rolls.html;Hey man,Do your guesses ever know,Hey man,Won't you kick me down some luck,Hey man, watch your language, motherfuck, ,Drown my enemies,Drown my enemies,Force inside of me,Roll,Dead Kennedy,Roll, ,Hey man,Won't kick me down some luck,Hey man,Do your guesses ever know,Hey man,Watch your language motherfuck,Watch your language motherfuck, ,Drown my enemies,Drown my enemies,Force inside of me,Roll,Dead Kennedy,Roll, ,Hey man,Won't you kick me down some luck,Hey man,Watch your language motherfuck,Hey man,Won't you kick me down some luck,Hey man,Watch your language motherfuck
Detroit Rock City;KISS;Paul Stanley,Bob Ezrin;;;;;;https://www.metallica.com/songs/detroit-rock-city.html;I feel uptight on a Saturday night,Nine o’ clock the radio’s the only light,I hear my song and it pulls me through,Comes on strong tells me what I got to do,I got to, ,Get up,Everybody’s gonna move their feet,Get down,Everybody’s gonna leave their seat,You gotta lose your mind in Detroit Rock City, ,Get up,Everybody’s gonna move their feet,Get down,Everybody’s gonna leave their seat, ,Getting late,I just can’t wait,Ten o’clock and I know I gotta hit the road,First I drink then I smoke,Start up the car and I try to make the midnight show, ,Get up,Everybody’s gonna move their feet,Get down,Everybody’s gonna leave their seat, ,Movin’ fast doin’ 95,Hit top speed but I’m still movin’ much too slow,I feel so good I’m so alive,I hear my song playin’ on the radio,It goes, ,Get up,Everybody’s gonna move their feet,Get down,Everybody’s gonna leave their seat, ,Twelve o’clock I gotta rock,There’s a truck ahead lights starin’ at my eyes,Oh my God no time to turn,I got to laugh ‘cause I know I’m gonna die,Why, ,Get up,Everybody’s gonna move their feet,Get up,Everybody’s gonna leave their seat
Devil’s Dance;Metallica;James Hetfield,Lars Ulrich;5:19;Reload;Album;3;1997-11-18;https://www.metallica.com/songs/devils-dance.html;I feel you too,Feel those things you do,In your eyes I see a fire that burns,To free the you,That’s wanting through,Deep inside you know the seeds I plant will grow, ,One day you will see,And dare to come down to me,C’mon c’mon now take the chance,That’s right let’s dance, ,Snake I am the snake,Tempting that bite to take,Let me make your mind,Leave yourself behind,Be not afraid,I’ve got what you need,Hunger I will feed, ,One day you will see,And dare to come down to me,C’mon c’mon now take the chance,Come dance, ,One day you will see,And dare to come down to me,C’mon c’mon now take the chance, ,I feel you too,Feel those things you do,In your eyes I see a fire that burns,To free the you,That’s running through,Deep inside you know,Seeds I plant will grow, ,One day you will see,And dare to come down to me,C’mon c’mon now take the chance,That’s right,Let’s dance, ,It’s nice to see you here
Diary of a Madman;Ozzy Osbourne;Ozzy Osbourne,Randy Rhoads,Bob Daisley,Lee Kerslake;;;;;;https://www.metallica.com/songs/diary-of-a-madman.html;Screaming at the window,Watch me die another day,Hopeless situation,Endless price I have to pay, ,Sanity now it’s beyond me,There’s no choice, ,Diary of a madman,Walk the line again today,Entries of confusion,Dear diary I’m here to stay, ,Manic depression befriends me,Hear my voice,Sanity now it’s beyond me,There’s no choice, ,A sickened mind and spirit,The mirror tells me lies,Could I mistake myself for someone,Who lives behind my eyes?,Will he escape my soul,Or will he live in me?,Is he trying to get out,Or trying to enter me?, ,Voices in the darkness,Scream away my mental health,Can I ask a question,To help me save me from myself?, ,Enemies fill up the pages,Are they me,Monday ’til Sunday in stages,Set me free
Die, Die My Darling;The Misfits;Glenn Danzig;2:29;Garage Inc.;Covers;5;1998-11-24;https://www.metallica.com/songs/die-die-my-darling.html;Die die die my darling,Don’t utter a single word,Die die die my darling,Just shut your pretty eyes, ,I’ll be seeing you again,I’ll be seeing you in Hell, ,So don’t cry to me oh baby,Your future’s in an oblong box,Don’t cry to me oh baby,Should have seen it a-coming on,Don’t cry to me oh baby,I don’t know it was in your cards,Don’t cry to me oh baby,Dead end zone for a dead end girl,Don’t cry to me oh baby,Now your life drains on that floor,Don’t cry to me oh baby, ,Die die die my darling,Don’t utter a single word,Die die die my darling,Just shut your pretty mouth, ,I’ll be seeing you again,I’ll be seeing you in Hell, ,Die die die
Dirty Window;Metallica;James Hetfield,Lars Ulrich,Kirk Hammett,Bob Rock;5:24;St. Anger;Album;4;2003-06-05;https://www.metallica.com/songs/dirty-window.html;I see my reflection in the window,It looks different so different than what you see,Projecting judgment on the world,This house is clean baby,This house is clean, ,Am I who I think I am?,Am I who I think I am?,Am I who I think I am?,Look out my window and see it’s gone wrong,Court is in session and I slam my gavel down, ,I’m judge and I’m jury and I’m executioner too, ,Projector,Protector,Rejector,Infector,Projector,Rejector,Infector,Injector,Defector,Rejector, ,I see my reflection in the window,This window clean inside dirty on the out,I’m looking different than me,This house is clean baby,This house is clean, ,Am I who I think I am?,Am I who I think I am?,Am I who I think I am?,I look out my window and see it’s gone wrong,My court is in session and now I slam my gavel down, ,I’m judge and I’m jury and I’m executioner too, ,Projector,Protector,Rejector,Infector,Projector,Rejector,Infector,Injector,Defector,Rejector,Detector, ,I drink from the cup of denial,I’m judging the world from my throne,I drink from the cup of denial,I’m judging the world from my throne
Disposable Heroes;Metallica;James Hetfield,Lars Ulrich,Kirk Hammett;8:17;Master of Puppets;Album;5;1986-03-03;https://www.metallica.com/songs/disposable-heroes.html;Bodies fill the fields I see hungry heroes end,No one to play soldier now no one to pretend,Running blind through killing fields bred to kill them all,Victim of what said should be,A servant ’til I fall, ,Soldier boy made of clay,Now an empty shell,Twenty-one only son,But he served us well,Bred to kill not to care,Do just as we say,Finished here,Greetings Death,He’s yours to take away, ,Back to the front,You will do what I say when I say,Back to the front,You will die when I say you must die,Back to the front,You coward,You servant,You blind man, ,Barking of machinegun fire does nothing to me now,Sounding of the clock that ticks get used to it somehow,More a man more stripes you bare glory-seeker trends,Bodies fill the fields I see,The slaughter never ends, ,Soldier boy made of clay,Now an empty shell,Twenty-one only son,But he served us well,Bred to kill not to care,Do just as we say,Finished here,Greetings Death,He’s yours to take away, ,Back to the front,You will do what I say when I say,Back to the front,You will die when I say you must die,Back to the front,You coward,You servant,You blind man, ,Why am I dying?,Kill have no fear,Lie live off lying,Hell hell is here, ,I was born for dying, ,Life planned out before my birth nothing could I say,Had no chance to see myself molded day by day,Looking back I realize nothing have I done,Left to die with only friend,Alone I clench my gun, ,Soldier boy made of clay,Now an empty shell,Twenty-one only son,But he served us well,Bred to kill not to care,Do just as we say,Finished here,Greetings Death,He’s yours to take away, ,Back to the front,You will do what I say when I say,Back to the front,You will die when I say you must die,Back to the front,You coward,You servant,You blind man, ,Back to the front
Don’t Tread On Me;Metallica;James Hetfield,Lars Ulrich;4:00;Metallica;Album;6;1991-08-12;https://www.metallica.com/songs/dont-tread-on-me.html;Liberty or death what we so proudly hail,Once you provoke her rattling of her tail, ,Never begins it never but once engaged...,Never surrenders showing the fangs of rage, ,Don’t tread on me, ,So be it,Threaten no more,To secure peace is to prepare for war, ,So be it,Settle the score,Touch me again for the words that you will hear evermore..., ,Don’t tread on me, ,Love it or leave it she with the deadly bite,Quick is the blue tongue forked as the lighting strike,Shining with brightness always on surveillance,The eyes they never close emblem of vigilance, ,Don’t tread on me, ,So be it,Threaten no more,To secure peace is to prepare for war, ,So be it,Settle the score,Touch me again for the words that you will hear evermore..., ,Don’t tread on me, ,So be it,Threaten no more,To secure peace is to prepare for war, ,Liberty or death what we so proudly hail,Once you provoke her rattling of her tail, ,So be it,Threaten no more,To secure peace is to prepare for war, ,So be it,Settle the score,Touch me again for the words that you will hear evermore..., ,Don’t tread on me
Dragon;Metallica;Lou Reed,James Hetfield,Lars Ulrich,Kirk Hammett,Robert Trujillo;11:10;Lulu;Collaborative;9;2011-10-31;https://www.metallica.com/songs/dragon.html;You don’t actually care,Love for you is no beginning,You’re not really there,Hallucination,I thought you were listening,Hallucination,I thought you were listening,Hallucination, ,I understand you think you’re above it,The adolescent sense of the sky,The feeling of billowing heartbeats,The fingertips run through your hair, ,They run through your hair,Hallucination,Hallucination, ,Oh you think you’re so special,That there’s no law meant for you,You come and go like the goddess you are,We’re mere mortals below,Fingertips run through your hair,We are mere mortals below, ,Are meant to be peons,Are meant to be servants,Are meant to be dismissible objects,One fucks with,One fucks with, ,Poor pitiful creature, ,The winner in heartbreak,The winner in caring,The winner in every minuscule method of wearing,Your heart on your sleeve,A red star of idiocy, ,An idiot’s idiocy,My my caring for you,Caring for you,Do you think we’re a book,Some kind of a table,You can rest your feet on when you’re able, ,Red star of idiocy,An idiot’s idiocy,My caring for you,Poor pitiful creature,To notice the pining,The self deprivation,The self flagellation of you,Dear worshippers, ,We do like you regal,We do like you haughty,We do love to look upon your perfect body, ,The hair on your shoulders,The smell of your armpit,The taste of your vulva and everything on it,We all really love you,And you have no meaning,You don’t even see us,You were never caring, ,You go do what you do,You do it for you,No one exists with you,You’re way above caring,Leave a trail upon the wake,That no one ever tries to take,Because waiting for you,Thinking of you,Is another way of dying,Is another way of dying, ,I’m clawing your chest,‘Til your collarbone bleeds,Piercing your nipples ’til I bite them off,I scratch your face and bite your shoulders,Way above caring,Way above caring,And your Kotex jukebox,Your Kotex jukebox, ,I’m doomed I’m swearing,Waiting for you,In your high heels and nightie, ,Your leather dress squeaking,Latex now sweating waiting for you,In your tincture,Your opium white bathrobe,Your white tiles run red now,Are we both dead now?,The liquid exchange of our heart,The liquid exchange of our heart,Are we both dead now?, ,You’re way above caring,Your heart on your sleeve,A red star of idiocy,An idiot’s idiocy,My caring,My caring for you,My caring for you,You’re way beyond caring,Your heart on your sleeve,A red star of idiocy,An idiot’s idiocy, ,My caring for you,Oblivious to caring,Oblivious to caring,Oblivious to caring,Leave a trail upon the wake,That no one ever tries to take,Because waiting for you,Because thinking of you,Is another way of dying, ,You’re way above caring,Oblivious to caring,Oblivious to caring,You poor pitiful creature,The mistake of feeling,The one who rejects you is the winner,It’s true,The winner in heartbreak,The winner in caring,The winner in every miniscule method of wearing,Your heart on your sleeve,A red star of idiocy, ,An idiot’s idiocy,Your heart on your fuckin’ sleeve,My caring for you,We were meant to be peons,We’re meant to be peons,Mere mortals below,Meant to be servants,Meant to be dismissible objects one fucks with,Oh oh oh you’re so special,No law meant for you,You come and go like the goddess you are, ,The fingertips run through your hair,A billowing heart beats,Feeling,Feeling,What a glorious feeling,To be so rejected,So rejected, ,An idiot’s idiocy,My caring for you,You think I’m a book or a table,You can rest your fuckin’ feet on,When you’re able, ,The taste of your vulva everything on it,The hair on your shoulders,The smell of your armpit,We do love you to look upon your perfect body,We love you regal,We love you haughty,Oblivious to caring,Oblivious to caring,Caring, ,Oh my dear,Oh my dear,Oh my dear,Oblivious to caring, ,Are we really dead now?,Are we both dead now?
Dream No More;Metallica;James Hetfield,Lars Ulrich;6:29;Hardwired... to Self-Destruct;Album;5;2016-11-18;https://www.metallica.com/songs/dream-no-more.html;He sleeps under black seas waiting,Lies dreaming in death,He sleeps under cosmos shaking,Stars granting his breath, ,He wakes as the world dies screaming,All horrors arrive,He wakes giving earth its bleeding,Pure madness alive, ,And He haunts you,And He binds your soul,And He loathes you,And reclaims it all, ,You turn to stone,Can’t look away,You turn to stone,Madness they say, ,Cthulhu awaken, ,He sways in abyss returning,Inhaling black skies,He shakes with a torture burning,All lost in his eyes, ,And He haunts you,And He binds your soul,And He loathes you,And reclaims it all, ,You turn to stone,Can’t look away,You turn to stone,Madness they say, ,Cthulhu awaken, ,You turn to stone,Can’t look away,You turn to stone,Madness they say, ,Sanity taken,Seething damnation,Cthulhu awaken,(Wake) Winged salvation,Death by creation,Cthulhu awaken,(Wake) Dreaming no more, ,Cthulhu awaken,(Wake) Dreaming no more,Cthulhu awaken,(Wake) Dreaming no more
Dyers Eve;Metallica;James Hetfield,Lars Ulrich,Kirk Hammett;5:14;...And Justice for All;Album;9;1988-08-25;https://www.metallica.com/songs/dyers-eve.html;Dear Mother,Dear Father,What is this hell you have put me through,Believer,Deceiver,Day in day out live my life through you,Pushed onto me what’s wrong or right,Hidden from this thing that they call life, ,Dear Mother,Dear Father,Every thought I’d think you’d disapprove,Curator,Dictator,Always censoring my every move,Children are seen but are not heard,Tear out everything inspired, ,Innocence,Torn from me without your shelter,Barred reality,I’m living blindly, ,Dear Mother,Dear Father,Time has frozen still what’s left to be,Hear nothing,Say nothing,Cannot face the fact I think for me,No guarantee it’s life as is,But damn you for not giving me my chance, ,Dear Mother,Dear Father,You’ve clipped my wings before I learned to fly,Unspoiled,Unspoken,I’ve outgrown that fucking lullaby,Same thing I’ve always heard from you,Do as I say not as I do, ,Innocence,Torn from me without your shelter,Barred reality,I’m living blindly, ,I’m in hell without you,Cannot cope without you two,Shocked at the world that I see,Innocent victim please rescue me, ,Dear Mother,Dear Father,Hidden in your world you’ve made for me,I’m seething,I’m bleeding,Ripping wounds in me that never heal,Undying spite I feel for you,Living out this hell you always knew
The Ecstasy of Gold;Ennio Morricone;Ennio Morricone;3:50;We All Love Ennio Morricone;Compilation;5;2007-02-19;https://www.metallica.com/songs/the-ecstasy-of-gold.html;Instrumental
The End of the Line;Metallica;James Hetfield,Lars Ulrich,Kirk Hammett,Robert Trujillo;7:50;Death Magnetic;Album;2;2008-09-12;https://www.metallica.com/songs/the-end-of-the-line.html;Need... more and more,Tainted misery,Bleed... battle scars,Chemical affinity,Reign... legacy,Innocence corrode,Stain... rot away,Catatonic overload, ,Choke... asphyxia,Snuff reality,Scorch... kill the light,Incinerate celebrity,Reaper... butchery,Karma amputee,Bloodline... redefine,Death contagious deity, ,Hooked into this deceiver,Need more and more,Into the endless fever,Need more and more, ,New consequence machine,You burn through all your gasoline,Asylum overtime,Nevermind...,You’ve reached the end of the line, ,Time... Choke the clock,Steal another day,Die... Faithfully,Narcissistic fade away,Twisted... Jump the rail,Shatter the crowd below,Breaker... Chase the ghost,From latest high to all-time low, ,Hooked into this deceiver,Need more and more,Into the endless fever,Need more and more, ,New consequence machine,Burn through all your gasoline,Asylum overtime,Nevermind...,You’ve reached the end of the line, ,Drop the hourglass of time,Spilling sand we will not find,As we gather here today,We bid farewell...,The slave becomes the master,The slave becomes the master,The slave becomes the master, ,The slave becomes the master,Need more and more,Right now and ever after,Need more and more, ,New consequence machine,Burn through all your gasoline,Asylum overtime,Nevermind...,Dead hourglass of time,Sand we will not ever find,We gather here today,Say goodbye,Cause you’ve reached the end of the line,The end of the line,The end of the line,The end of the line,You’ve reached the end of the line
Enter Sandman;Metallica;James Hetfield,Lars Ulrich,Kirk Hammett;5:31;Metallica;Album;1;1991-08-12;https://www.metallica.com/songs/enter-sandman.html;Say your prayers little one,Don’t forget my son,To include everyone,Tuck you in warm within,Keep you free from sin,Till the sandman he comes, ,Sleep with one eye open,Gripping your pillow tight, ,Exit: light,Enter: night,Take my hand,We’re off to never never land, ,Something’s wrong shut the light,Heavy thoughts tonight,And they aren’t of Snow White,Dreams of war dreams of liars,Dreams of dragon’s fire,And of things that will bite, ,Sleep with one eye open,Gripping your pillow tight, ,Exit: light,Enter: night,Take my hand,We’re off to never never land, ,Now I lay me down to sleep,Pray the Lord my soul to keep,If I die before I wake,Pray the Lord my soul to take,Hush little baby don’t say a word,And never mind that noise you heard,It’s just the beasts under your bed,In your closet in your head, ,Exit: light,Enter: night,Grain of sand,Exit: light,Enter: night,Take my hand,We’re off to never never land
Escape;Metallica;James Hetfield,Lars Ulrich,Kirk Hammett;4:24;Ride the Lightning;Album;6;1984-07-27;https://www.metallica.com/songs/escape.html;Feel no pain but my life ain’t easy,I know I’m my best friend,No one cares but I’m so much stronger,I’ll fight until the end, ,To escape from the true false world,Undamaged destiny,Can’t get caught in the endless circle,Ring of stupidity, ,Out for my own out to be free,One with my mind they just can’t see,No need to hear things that they say,Life’s for my own to live my own way, ,Rape my mind and destroy my feelings,Don’t tell me what to do,I don’t care now ‘cause I’m on my side,And I can see through you, ,Feed my brain with your so-called standards,Who says that I ain’t right?,Break away from your common fashion,See through your blurry sight, ,Out for my own out to be free,One with my mind they just can’t see,No need to hear things that they say,Life’s for my own to live my own way, ,See them try to bring the hammer down,No damn chains can hold me to the ground, ,Life’s for my own to live my own way
Eye of the Beholder;Metallica;James Hetfield,Lars Ulrich,Kirk Hammett;6:25;...And Justice for All;Album;3;1988-08-25;https://www.metallica.com/songs/eye-of-the-beholder.html;Do you see what I see?,Truth is an offense,Your silence for your confidence, ,Do you hear what I hear?,Doors are slamming shut,Limit your imagination keep you where they must, ,Do you feel what I feel?,Bittering distress,Who decides what you express?, ,Do you take what I take?,Endurance is the word,Moving back instead of forward seems to me absurd, ,Doesn’t matter what you see,Or into it what you read,You can do it your own way,If it’s done just how I say, ,Independence limited,Freedom of choice,Choice is made for you my friend,Freedom of speech,Speech is words that they will bend,Freedom with their exception, ,Do you fear what I fear?,Living properly,Truths to you are lies to me, ,Do you choose what I choose?,More alternatives,Energy derives from both the plus and negative, ,Do you need what I need?,Boundaries overthrown,Look inside to each his own, ,Do you trust what I trust?,Me myself and I,Penetrate the smoke screen I see through the selfish lie, ,Doesn’t matter what you see,Or into it what you read,You can do it your own way,If it’s done just how I say, ,Independence limited,Freedom of choice,Choice is made for you my friend,Freedom of speech,Speech is words that they will bend,Freedom with their exception, ,Do you know what I know?,Your money and your wealth,Your silence just to hear yourself, ,Do you want what I want?,Desire not a thing,I hunger after independence lengthen freedom’s ring, ,Doesn’t matter what you see,Or into it what you read,You can do it your own way,If it’s done just how I say, ,Independence limited,Freedom of choice,Choice is made for you my friend,Freedom of speech,Speech is words that they will bend,Freedom no longer frees you, ,Doesn’t matter what you see,Or into it what you read,You can do it your own way,If it’s done just how I say
Fade to Black;Metallica;James Hetfield,Lars Ulrich,Cliff Burton,Kirk Hammett;6:55;Ride the Lightning;Album;4;1984-07-27;https://www.metallica.com/songs/fade-to-black.html;Life it seems will fade away,Drifting further every day,Getting lost within myself,Nothing matters no one else, ,I have lost the will to live,Simply nothing more to give,There is nothing more for me,Need the end to set me free, ,Things not what they used to be,Missing one inside of me,Deathly lost this can’t be real,Cannot stand this hell I feel, ,Emptiness is filling me,To the point of agony,Growing darkness taking dawn,I was me but now he’s gone, ,No one but me can save myself but it’s too late,Now I can’t think think why I should even try, ,Yesterday seems as though it never existed,Death greets me warm now I will just say goodbye
Fight Fire with Fire;Metallica;James Hetfield,Lars Ulrich,Cliff Burton;4:44;Ride the Lightning;Album;1;1984-07-27;https://www.metallica.com/songs/fight-fire-with-fire.html;Do unto others as they’ve done to you,But what the hell is this world coming to?, ,Blow the universe into nothingness,Nuclear warfare shall lay us to rest, ,Fight fire with fire,Ending is near,Fight fire with fire,Bursting with fear, ,We all shall die, ,Time is like a fuse short and burning fast,Armageddon’s here like said in the past, ,Fight fire with fire,Ending is near,Fight fire with fire,Bursting with fear, ,Soon to fill our lungs the hot winds of death,The gods are laughing so take your last breath, ,Fight fire with fire,Ending is near,Fight fire with fire,Bursting with fear, ,Fight fire with fire, ,Fight
