Song;Author_band;Songwriters;Duration;Album;Album_type;No_on_album;Release_date;Link;Lyrics
Ronnie;Metallica;James Hetfield,Lars Ulrich;5:17;Load;Album;13;1996-06-04;https://www.metallica.com/songs/ronnie.html;Story starts quiet town,Small-town boy big-time frown,Never talks never plays,Different path lost his way, ,Then streets of red... red I’m afraid...,There’s no confetti no parade,Nothing happens in this boring place,But oh my God how it all did change, ,Now they all pray,“Bloodstain wash away”, ,He said,“Lost my way,This bloody day,Lost my way”, ,I heard it,He said,“Lost my way,This bloody day,Lost my way”,Oh please wash away,But blood stained the sun red today, ,I always said something’s wrong,With little strange Ronnie Long,Never laughed never smiled,Talked alone for miles and miles and miles, ,“Gallows calls son” I say,Keep your smile and laugh all day,Think once again in this boring place,For little boys how they soon change,And they all pray,“Bloodstain wash away”, ,He said,“I lost my way,This bloody day,Lost my way”,I heard it,He said,“I lost my way,This bloody day,I lost my way”,Oh please wash away,But blood stained the sun red today, ,Well all the green things died when Ronnie moved to this place,He said “Don’t you dare ask why I’m cursed to wear this face”,Now we all know why the children called him Ronnie Frown,When he pulled that gun from his pocket they all fall down down down, ,He said,“Lost my way,This bloody day,Lost my way”, ,Yeah yeah,I heard it,He screamed,“Lost my way,This bloody day,Lost my way”, ,Oh please wash away,But blood stained the sun red today, ,All things wash away,And they all fall down,But blood stained the sun today, ,All things wash away,And they all fall down,But blood stained the sun today
Ronnie Rising Medley;Rainbow;Ritchie Blackmore,Ronnie James Dio,Cozy Powell;9:04;Ronnie James Dio – This Is Your Life;Compilation;2;2014-03-25;https://www.metallica.com/songs/ronnie-rising-medley.html;I don’t wanna go,Something tells me no no no no,But traces in the sand,The lines inside my hand say go go go, ,Beware of a place,A smile on a bright shiny face,I’ll never return how do you know, ,Tarot woman,I don’t know,I don’t know,I don’t know, ,She can take you there,The entrance to the fair my my my,Ride the carousel,Cast a magic spell you can fly fly fly, ,Beware of a place,A smile on a bright shiny face,I’ll never return how do you know, ,Tarot woman,I don’t know,I don’t know,I don’t know, ,High noon,Oh I’d sell my soul for water,Nine years’ worth,Of breakin’ my back,There’s no sun in the shadow of the wizard,See how he glides,Why he’s lighter than air,Oh I see his face, ,Where is your star,Is it far is it far is it far,When do we leave,I believe I believe yes I believe, ,In the heat and the rain,With whips and chains,Just to see him fly,So many die, ,We built a tower of stone,With our flesh and bone,Just to see him fly,Don’t know why, ,Now where do we go.., ,Danger danger the Queen’s about to kill,There’s a stranger stranger and life about to spill,Oh no move away from harm,I need a spell and a charm,Fly like the wind,I’m no pawn so be gone speed on and on, ,Kill the king,Tear him down,Kill the king yeah,Strike him down, ,Power power happens every day,Power devour all along the way,Oh no move away from harm,I need a spell and a charm,And fly like the wind,I’m no pawn so be gone speed on and on, ,Kill the king,Strike him down, ,Treason treason the spectre looms again,Treason reason the realm is safe and then,Oh no move away from harm,I need a spell and a charm,Fly like the rainbow,I’m no pawn so be gone speed on and on, ,Kill the king,Tear him down,Kill the king,Got to take his crown
Room of Mirrors;Metallica;James Hetfield,Lars Ulrich;5:34;72 Seasons;Album;11;2023-04-14;https://www.metallica.com/songs/room-of-mirrors.html;In a mirrored room,All alone I stand,Strip away the phantom fame,Exposing all sides to see,The good and bad in me, ,In a mirrored room,All alone I stand,Seeing past the flesh and bone,The shame and the fear I hide,Could I show you what’s inside?, ,Would you,Criticize scrutinize,Stigmatize my pain?,Would you,Summarize patronize,Classify insane?, ,So I stand here,Before you,You might judge,You might just bury me, ,Or you might set me free, ,In a mirrored room,Talking to myself,And the voices pushing back,I’ll let them inside my heart,But they’ll tear it all apart, ,In a mirrored room,Just a simple man,Naked broken beat and scarred,What do I really know?,That fear of letting go, ,Would you,Criticize scrutinize,Analyze my pain?,Would you,Summarize patronize,Classify insane?, ,So I stand here,Before you,You might judge,You might just bury me, ,Or you might set me,Or you might set me free, ,Would you,Criticize scrutinize,Ostracize my pain?,Would you,Summarize patronize,Classify insane?, ,So I stand here,Before you,You might judge,You might just bury me, ,Or you might set me,Oh please won’t you set me free
Sabbra Cadabra;Black Sabbath;Tony Iommi,Ozzy Osbourne,Geezer Butler,Bill Ward;6:20;Garage Inc.;Covers;3;1998-11-24;https://www.metallica.com/songs/sabbra-cadabra.html;Feel so good I feel so fine,Love that little lady always on my mind,She gives me lovin’ every night and day,Never gonna leave her,Never goin’ away, ,Someone to love me,You know she makes me feel alright, ,Someone to need me,Love me every single night, ,Feel so happy since I met that girl,When we’re making love,It’s something out of this world,Feels so good to know that she’s all mine,Gonna love that woman ’til the end of time, ,Someone to live for,Love me ’til the end of time, ,She makes me feel happy,It’s good to know that she’s all mine, ,I am the world that hides,The universal secret of all time,Destruction of the empty spaces,Is my one and only crime,I lived a thousand times,I found out what it means to be believed,The thoughts and images,The unborn child that never was conceived, ,You gotta believe me,Hey I’m talkin’ to you,Well I know its hard for you,To know the reason why,And I know you’ll understand,More when it’s time to die,Don’t believe the life you have,Will be the only one,You have to let your body sleep,To let your soul live on, ,Feel so happy since I met that girl,When we’re making love,It’s something out of this world,Feels so good to know that she’s all mine,Gonna love that woman ’til the end of time,Someone to live for,Love me ’til the end of time,She make me feel happy,It’s good to know that she’s all mine,She’s all mine
Sad But True;Metallica;James Hetfield,Lars Ulrich;5:24;Metallica;Album;2;1991-08-12;https://www.metallica.com/songs/sad-but-true.html;Hey,I’m your life,I’m the one who takes you there, ,Hey,I’m your life,I’m the one who cares, ,They,They betray,I’m your only true friend now, ,They,They’ll betray,I’m forever there, ,I’m your dream make you real,I’m your eyes when you must steal,I’m your pain when you can’t feel,Sad but true, ,I’m your dream mind astray,I’m your eyes while you’re away,I’m your pain while you repay,You know it’s sad but true, ,You,You’re my mask,You’re my cover my shelter, ,You,You’re my mask,You’re the one who’s blamed, ,Do,Do my work,Do my dirty work scapegoat, ,Do,Do my deeds,For you’re the one who’s shamed, ,I’m your dream make you real,I’m your eyes when you must steal,I’m your pain when you can’t feel,Sad but true, ,I’m your dream mind astray,I’m your eyes while you’re away,I’m your pain while you repay,You know it’s sad but true, ,Hate,I’m your hate,I’m your hate when you want love, ,Pay,Pay the price,Pay for nothing’s fair, ,Hey,I’m your life,I’m the one who took you there, ,Hey,I’m your life,And I no longer care, ,I’m your dream make you real,I’m your eyes when you must steal,I’m your pain when you can’t feel,Sad but true, ,I’m your truth telling lies,I’m your reason alibis,I’m inside open your eyes,I’m you,Sad but true
Screaming Suicide;Metallica;James Hetfield,Lars Ulrich,Robert Trujillo;5:30;72 Seasons;Album;3;2023-04-14;https://www.metallica.com/songs/screaming-suicide.html;Welcome to this life,Born into the fight,Here to claim your dream,Look you in the eye,Patch the broken sky,Craving dopamine,Then my voice appears,Teaching you of fears,Are you good enough?,You don’t recognize,Head is full of lies,You should just give up, ,Listen well better listen well,Listen well better listen well, ,Don’t ever speak my name,Remember you’re to blame,Keep me inside,Keep me inside,My name is suicide, ,Curse another day,Spirit locked away,Punish and deprive,Hate to be awake,Living a mistake,More dead than alive,Then a voice appears,Whisper in your ears,“You are good enough”,Throwing down a rope,A lifeline of hope,Never give you up, ,Listen well better listen well,Listen well better listen well, ,Don’t ever speak my name,Remember you’re to blame,Keep me inside,Keep me inside,My name is suicide, ,Terrified in sleepless nights,Caught in spotlight dead to rights,Isolate and fight your mind,Telling you you’re left behind, ,My lying voice inside,Keeps drinking cyanide,And no more can you run,Into the sun, ,Terrified sleepless nights,Caught in spotlight dead to rights,Isolate and fight your mind,Telling you you’re left behind, ,And now you speak my name,You’ve given back the blame,Keep me deep inside,Don’t you keep me inside,Screaming suicide, ,Now that I’m exposed inside,Shined a light on cyanide,I’m no longer needed here,Now you've faced your biggest fear
Seek & Destroy;Metallica;James Hetfield,Lars Ulrich;6:54;Kill 'Em All;Album;9;1983-07-25;https://www.metallica.com/songs/seek-and-destroy.html;We’re scanning the scene in the city tonight,We’re looking for you to start up a fight,There’s an evil feeling in our brains,But it’s nothing new you know it drives us insane, ,Running,On our way,Hiding,You will pay,Dying,One thousand deaths,Running,On our way,Hiding,You will pay,Dying,One thousand deaths, ,Searching,Seek and destroy,Searching,Seek and destroy,Searching,Seek and destroy,Searching,Seek and destroy, ,There is no escape and that’s for sure,This is the end we won’t take any more,Say goodbye to the world you live in,You’ve always been taking but now you’re giving, ,Running,On our way,Hiding,You will pay,Dying,One thousand deaths,Running,On our way,Hiding,You will pay,Dying,One thousand deaths, ,Searching,Seek and destroy,Searching,Seek and destroy,Searching,Seek and destroy,Searching,Seek and destroy, ,Our brains are on fire with the feeling to kill,And it won’t go away until our dreams are fulfilled,There is only one thing on our minds,Don’t try running away,‘cause you’re the one we will find, ,Running,On our way,Hiding,You will pay,Dying,One thousand deaths,Running,On our way,Hiding,You will pay,Dying,One thousand deaths, ,Searching,Seek and destroy,Searching,Seek and destroy,Searching,Seek and destroy,Searching,Seek and destroy
Shadows Follow;Metallica;James Hetfield,Lars Ulrich;6:12;72 Seasons;Album;2;2023-04-14;https://www.metallica.com/songs/shadows-follow.html;Hanging by a thread as I play dead,Hanging by a thread and my mind is code red,Cut and run try to hide get away,shut my eyes just to hide from the fate,Cut and run try to hide get away,cover up get shelter from the hate, ,Demonized liquified tranquilized,prophesied just to hide from life,Night and day led astray in decay,come what may not to face that fight, ,Seething,Breathing,Nightmares grow,On I run,Still my shadows follow, ,Never can I stop cause they hunt me,Never can I stop cause the beast is hungry,Like a wolf on the hunt stalking prey,Closing in no it won’t let me be,Like a wolf on the hunt stalks a prey,Any cost fulfill a destiny, ,Seething,Fast breathing,Nightmares grow,On I run,Still my shadows follow,On I run,But still my shadows follow, ,Cut and run hide away from fate,Cover up try to hide the hate,Like a wolf it won’t let me be,Closing in wish away shut my eyes, ,Wish it away, ,Seething,Fast breathing,Nightmares grow,On I run,Still my shadows follow, ,Facing,My demons,Now I know,If I run,Still my shadows follow, ,I say NO!,Still my shadows follow
Shoot Me Again;Metallica;James Hetfield,Lars Ulrich,Kirk Hammett,Bob Rock;7:10;St. Anger;Album;7;2003-06-05;https://www.metallica.com/songs/shoot-me-again.html;I won’t go away,Right here I’ll stay, ,Stand silent in flames,Stand tall ’till it fades, ,Shoot me again,I ain’t dead yet, ,Shoot me again, ,All the shots I take,I spit back at you,All the shit you fake,Comes back to haunt you, ,All the shots, ,All the shots I take,What difference did I make?,All the shots I take,I spit back at you, ,I won’t go away with a bullet in my back,Right here I’ll stay with a bullet in my back, ,Shoot me,Take a shot, ,I’ll stand on my own with a bullet in my back,I’m stranded and sold with a bullet in my back, ,I bite my tongue,Trying not to shoot back,No compromise,My heart won’t pump the other way, ,Wake the sleeping giant,Wake the beast,Wake the sleeping dog,No let him sleep
The Shortest Straw;Metallica;James Hetfield,Lars Ulrich;6:35;...And Justice for All;Album;5;1988-08-25;https://www.metallica.com/songs/the-shortest-straw.html;Suspicion is your name,Your honesty to blame,Put dignity to shame,Dishonor,Witchhunt modern day,Determining decay,The blatant disarray,Disfigure,The public eye’s disgrace,Defying common place,Unending paper chase,Unending, ,Deafening,Painstaking,Reckoning,This vertigo it doth bring, ,Shortest straw,Challenge liberty,Downed by law,Live in infamy,Rub you raw,Witchhunt riding through,Shortest straw,The shortest straw has been pulled for you, ,Pulled for you,Shortest straw,Pulled for you,Shortest straw,Pulled for you,Shortest straw,The shortest straw has been pulled for you, ,The accusations fly,Discrimination why?,Your inner self to die,Intruding,Doubt sunk itself in you,Its teeth and talons through,You’re living Catch-22,Deluding,A mass hysteria,A megalomania,Reveal dementia,Reveal, ,Secretly,Silently,Certainly,In vertigo you will be, ,Shortest straw,Challenge liberty,Downed by law,Live in infamy,Rub you raw,Witchhunt riding through,Shortest straw,This shortest straw has been pulled for you, ,Pulled for you,Shortest straw,Pulled for you,Shortest straw,Pulled for you,Shortest straw,Shortest straw has been pulled for you,Shortest straw,Pulled for you,Shortest straw,Pulled for you,Shortest straw,Pulled for you,Shortest straw,Shortest straw has been pulled for you, ,Behind you hands are tied,Your being ostracized,Your hell is multiplied,Upending,The fallout has begun,Oppressive damage done,Your many turned to none,To nothing,You’re reaching your nadir,Your will has disappeared,The lie is crystal clear,Defending, ,Channels red,One word said,Blacklisted,With vertigo make you dead, ,Shortest straw,Challenge liberty,Downed by law,Live in infamy,Rub you raw,Witchhunt riding through,Shortest straw,The shortest straw has been pulled for you,Pulled for you
Sleepwalk My Life Away;Metallica;James Hetfield,Lars Ulrich,Robert Trujillo;6:56;72 Seasons;Album;4;2023-04-14;https://www.metallica.com/songs/sleepwalk-my-life-away.html;Take a deep waking breath,hope the blood arrives,Burn my eyes with the sun,and pretend I’m alive,It never will appear,strong as past desire,Light warming disappears,like a cold dead fire, ,Should I fall I fall down,Would you come you come round, ,Wake me,Caught in the spell I’m dreaming,Wake me,Day after day repeating,Wake me,Sleepwalk my life away, ,Stagger on through the fog,in the midnight sun,Shouting out at the shapes,of the nameless no ones,All isn’t what it seems,cannot comprehend it,Captive inside a dream,where the dawn won’t end it, ,Should I fall I fall down,Would you come you come round, ,Wake me,Caught in the spell I’m dreaming,Wake me,Day after day repeating,Wake me,Sleepwalk my life away, ,Should I fall I fall down,Would you come you come round, ,Wake me,Caught in the spell I’m dreaming,Wake me,Day after day repeating,Wake me,Sleepwalk my life away
Slither;Metallica;James Hetfield,Lars Ulrich,Kirk Hammett;5:13;Reload;Album;6;1997-11-18;https://www.metallica.com/songs/slither.html;Don’t go looking for snakes you might find them,Don’t send your eyes to the sun you might blind them,Haven’t I seen you here before?, ,Watch the puppets dancing,See the clowns fall down,Tie your tap shoes tightly,And wear them into town, ,See you crawlin’,See you crawlin’ in, ,Don’t go looking for snakes you might find them,Don’t send your eyes to the sun you might blind them,Haven’t I seen you here before?,There ain’t no heroes here no no more, ,Play the game so nicely,Check it’s your move now,We’re standing in this jungle,With serpents I have found, ,See you crawlin’,See you crawlin’ in, ,Don’t go looking for snakes you might find them,Don’t send your eyes to the sun you might blind them,Haven’t I seen you here before?,Have your heroes disappeared?, ,See you crawlin’,See you crawlin’ in, ,So don’t go looking for snakes you might find them,Don’t send your eyes to the sun you might blind them,Haven’t I seen you here before?,No there ain’t no heroes here no, ,Haven’t I seen you here before?,No there ain’t no heroes here, ,Don’t go looking for snakes you might find them,Haven’t I seen you here before?,Have your heroes disappeared?,Don’t send your eyes to the sun you might blind them
The Small Hours;Holocaust;John Mortimer;6:43;The $5.98 E.P. – Garage Days Re-Revisited;Covers EP;2;1987-08-21;https://www.metallica.com/songs/the-small-hours.html;Suck on this, ,Look hard at the darkness,And you will see,Just call my name and I’ll be there, ,You cannot touch me,You would not dare,I am the chill that’s in the air, ,And I try to get through to you,In my own special way,As the barriers crumble,At the end of the day, ,Dark rivers are flowing,Back into the past,You are the fish for which I cast, ,And what of the future,What is to be,As the rivers flow into the sea, ,And I try to get through to you,In my own special way,As the barriers crumble,At the end of the day, ,Do not take for granted,Powers out there,Don’t step into the demon’s lair, ,Time is an illusion,Rising from time,Steep is the mountain which we climb, ,And I try to get through to you,In my own special way,As the barriers crumble,At the end of the day
Some Kind of Monster;Metallica;James Hetfield,Lars Ulrich,Kirk Hammett,Bob Rock;8:25;St. Anger;Album;3;2003-06-05;https://www.metallica.com/songs/some-kind-of-monster.html;These are the eyes that can’t see me,These are the hands that drop your trust,These are the boots that kick you around,This is the tongue that speaks on the inside,These are the ears that ring with hate,This is the face that’ll never change,This is the fist that grinds you down,This is the voice of silence no more, ,These are the legs in circles run,This is the beating you’ll never know,These are the lips that taste no freedom,This is the feel that’s no so safe,This is the face you’ll never change,This is the God that ain’t so pure,This is the God that is not pure,This is the voice of silence no more, ,We the people,Are we the people?, ,Some kind of monster,The monster lives, ,This is the face that stones you cold,This is the moment that needs to breathe,These are the claws that scratch these wounds,This is the pain that never leaves,This is the tongue that whips you down,This is the burden of every man,These are the screams that pierce your skin,This is the voice of silence no more, ,This is the test of flesh and soul,This is the trap that smells so good,This is the flood that drains these eyes,These are the looks that chill to the bone,These are the fears that swing over head,These are the weights that hold you down,This is the end that will never end,This is the voice of silence no more, ,We the people,Are we the people?, ,Some kind of monster,The monster lives, ,This is the cloud that swallows trust,This is the black that uncolors us,This is the face that you hide from,This is the mask that comes undone, ,Ominous,I’m in us
So What;The Anti-Nowhere League;Nick Culmer,Chris Exall,Clive Blake;3:08;Metallica (Japan);Album;13;1991-08-12;https://www.metallica.com/songs/so-what.html;So fucking what, ,Well I’ve been to Hastings,I’ve been to Brighton,I’ve been to Eastbourne too, ,So what,So what, ,And I’ve been here,I’ve been there,I’ve been every fucking where, ,So what,So what,So what so what you boring little cunt, ,But who cares,Who cares what you do,Yeah who cares,Who cares about you you you you you, ,Well I’ve fucked a queen,I’ve fucked Bach,I’ve even sucked an old man’s cock, ,So what,So what, ,And I’ve fucked a sheep,I’ve fucked a goat,I rammed my cock right down it’s throat, ,So what,So what,So what so what you boring little fuck, ,But who cares,Who cares what you do,And who cares,Who cares about you you you you you, ,And I’ve drunk that,I’ve drunk this,I’ve spewed up on a pint of piss, ,So what,So what, ,I’ve had skank, I’ve have speed,I’ve jacked up until I bleed, ,So what,So what,So what so what you boring little cunt, ,But who cares,Who cares what you do,Yeah who cares,Who cares about you you you you you you, ,I’ve had crabs,I’ve had lice,I’ve had the clap and that ain’t nice, ,So what,So what, ,I’ve fucked this,I’ve fucked that,I’ve even fucked a school girl’s twat, ,So what,So what,So what so what you boring little fuck, ,Well who cares,Who cares what you do,And who cares,Who cares about you you you you you you, ,So fucking what
Spit Out the Bone;Metallica;James Hetfield,Lars Ulrich;7:09;Hardwired... to Self-Destruct;Album;12;2016-11-18;https://www.metallica.com/songs/spit-out-the-bone.html;Come unto me and you will feel perfection,Come unto me and dedicate,Come unto me you’ll never feel rejection,Come unto me and terminate,Remove your heart it’s only good for bleeding,Bleeding through your fragile skin,Remove your thought cause it’s only for deceiving,Deceiving thoughts destroy within,Disappear like man was never here, ,Long live machine,The future supreme,Man overthrown,Spit out the bone, ,Plug into me I guarantee devotion,Plug into me and dedicate,Plug into me and I’ll save you from emotion,Plug into me and terminate,Accelerate Utopian solution,Finally cure the Earth of man,Exterminate speeding up the evolution,Set on course a master plan,Reinvent the earth inhabitant, ,Long live machine,The future supreme,Man overthrown,Spit out the bone, ,The flesh betrays the flesh,Your man has had his time,We lay him down to rest,Machined the new divine, ,Stop breathing,And dedicate to me,Stop dreaming,And terminate for me,All meaning,You dedicate to me,All feelings,You terminate for me, ,Disappear like man was never here, ,Long live machine,Our future supreme,Your man overthrown,Spit out the bone yeah
St. Anger;Metallica;James Hetfield,Lars Ulrich,Kirk Hammett,Bob Rock;7:21;St. Anger;Album;2;2003-06-05;https://www.metallica.com/songs/st-anger.html;Saint Anger ’round my neck,Saint Anger ’round my neck,He never gets respect,Saint Anger ’round my neck, ,You flush it out you flush it out,Saint Anger ’round my neck,You flush it out you flush it out,He never gets respect, ,Fuck it all and no regrets,I hit the lights on these dark sets,I need a voice to let myself,To let myself go free,Fuck it all and fuckin’ no regrets,I hit the lights on these dark sets,Medallion noose I hang myself,Saint Anger ’round my neck, ,I feel my world shake,Like an earth quake,It’s hard to see clear,Is it me? Is it fear?, ,I’m madly in anger with you, ,And I want my anger to be healthy,And I want my anger just for me,And I need my anger not to control,And I want my anger to be me, ,And I need to set my anger free, ,Set it free
Stone Cold Crazy;Queen;Freddie Mercury,Brian May,Roger Taylor,John Deacon;2:17;Rubáiyát: Elektra's 40th Anniversary;Compilation;1;1990-09-24;https://www.metallica.com/songs/stone-cold-crazy.html;Sleeping very soundly on a Saturday morning,I was dreaming I was Al Capone,Rumor going round gotta clear out of town,Smelling like a dry fish bone, ,Here come the law gonna break down the door,Gonna carry me away once more,Never never,Never want it anymore,Gotta get away from this stone cold floor, ,Crazy,Stone cold crazy you know, ,Rainy afternoon on a killer typhoon,And I’m playing with my slide trombone,Anymore anymore,Cannot take it anymore,Gotta get away from this stone cold floor, ,Crazy,Stone cold crazy you know, ,Walking down the street shooting people that I meet,Bullet loaded tommy gun,Here come the deputy,Try fucking gettin’ me,Gotta fucking get up and run, ,They got the sirens lose I’m running out of juice,They’re gonna put me in a cell,If I can’t go to heaven let me go to hell, ,Crazy,Stone cold crazy you know
