Song;Author_band;Songwriters;Duration;Album;Album_type;No_on_album;Release_date;Link;Lyrics
Kill/Ride Medley;Metallica;James Hetfield,Lars Ulrich,Cliff Burton,Dave Mustaine;;;;;;https://www.metallica.com/songs/kill-ride-medley.html;Guilty as charged,But damn it it ain’t right,There’s someone else controlling me, ,Death in the air,Strapped in the electric chair,This can’t be happening to me, ,Who made you god to say,“I’ll take your life from you?”, ,Flash before my eyes,Now it’s time to die,Burning in my brain,I can feel the flame, ,No mercy for what we’re doing,No thought to even what we’ve done,We don’t need to feel the sorrow,No remorse for the helpless one, ,War without end,No remorse no repent,We don’t care what it meant,Another day another death,Another sorrow another breath,No remorse no repent,We don’t care what it meant,Another day another death,Another sorrow another breath, ,No life till leather,We’re gonna kick some ass tonight,We got the metal madness,When our fans start screaming,It’s right well alright,When we start to rock,We never want to stop again, ,Hit the lights,Hit the lights,Hit the lights, ,We know our fans are insane,We’re gonna blow this place away,With volume higher,Than anything today the only way,When we start to rock,We never want to stop again, ,Hit the lights,Hit the lights,Hit the lights, ,Time,Has taken a shit on you,The lines that crack your face,Famine,Your body it has torn through,Withered in every place,Pestilence,For what you’ve had to endure,And what you have put others through,Death,Deliverance for you for sure,Now there’s nothing you can do, ,Sound is ripping through your ears,The deafening sound of metal nears,Your body’s waiting for his whips,The taste of leather on your lips, ,Hear the cry of war,Louder than before,With his sword in hand,To control the land,Crushing metal strikes,On this frightening night,Fall onto your knees,For the Phantom Lord, ,Victims falling under chains,You hear them crying dying pains,Fist of terror’s breaking through,Now there’s nothing you can do, ,Hear the cry of war,Louder than before,With his sword in hand,To control the land,Crushing metal strikes,On this frightening night,Fall onto your knees,For the Phantom Lord, ,Soon to fill our lungs the hot winds of death,The gods are laughing so take your last breath, ,Fight fire with fire,Ending is near,Fight fire with fire,Bursting with fear, ,Fight fire with fire, ,Fight
Killing Time;Sweet Savage;Ray Haller,Vivian Campbell,Trevor Fleming,David Bates;3:06;The Unforgiven;Single;2;1991-10-28;https://www.metallica.com/songs/killing-time.html;Sound of gunfire comes through the night,Killing and hatred it’s a terrible sight,Reports come in of a heavy attack,Message received we’re moving back, ,Preparations are made for the journey back,Hints on survival supplies are packed,No more nights in this eternal hell,Destination is simple we move out, ,Killing time,Your life’s on the line,Killing time,Your turn to kill,Killing time,What’d ya say?,Killing time,The killing time, ,Ingenuity needed to keep us alive,No time for cowardice kill and survive,Like a killer kid with a switchblade knife,Nasty word he’ll take your life, ,The silence is over the attack again,The killing and hatred drive me insane,Reports come in of a heavy attack,Message received we’re moving back, ,Killing time,Your life’s on the line,Killing time,Your turn to kill,Killing time,What’d ya say?,Killing time,Killing time, ,Sound of gunfire comes through the night,Killing and hatred it’s a terrible sight,Reports come in of a heavy attack,Message received we’re moving back, ,Ingenuity needed to keep us alive,No time for cowardice kill and survive,Like a killer kid with a switchblade knife,Nasty word he’ll take your life, ,Killing time,Your life’s on the line,Killing time,Your turn to kill,Killing time,What’d ya say?,Killing time,The killing time
King Nothing;Metallica;James Hetfield,Lars Ulrich,Kirk Hammett;5:30;Load;Album;5;1996-06-04;https://www.metallica.com/songs/king-nothing.html;Wish I may wish I might,Have this I wish tonight,Are you satisfied?,Dig for gold dig for fame,You dig to make your name,Are you pacified?, ,All the wants you waste,All the things you’ve chased, ,Then it all crashes down,And you break your crown,And you point your finger,But there’s no one around,Just want one thing,Just to play the king,But the castle’s crumbled,And you’re left with just a name, ,Where’s your crown,King Nothing?,Where’s your crown?, ,Hot and cold bought and sold,A heart as hard as gold,Are you satisfied?,Wish I might wish I may,You wish your life away,Are you pacified?, ,All the wants you waste,All the things you’ve chased, ,Then it all crashes down,And you break your crown,And you point your finger,But there’s no one around,Just want one thing,Just to play the king,But the castle’s crumbled,And you’re left with just a name,Where’s your crown King Nothing?,Where’s your crown?, ,I wish I may I wish I might,Have this wish I wish tonight,I want that star I want it now,I want it all and I don’t care how, ,Careful what you wish,Careful what you say,Careful what you wish you may regret it,Careful what you wish you just might get it, ,Then it all crashes down,And you break your crown,And you point your finger,But there’s no one around,Just want one thing,Just to play the king,But the castle’s crumbled,And you’re left with just a name, ,Where’s your crown King Nothing?, ,,Nothing, ,You’re just nothing,Where’s your crown King Nothing?,You’re just nothing,Absolutely nothing, ,Off to never-never land
Last Caress;The Misfits;Glenn Danzig;;;;;;https://www.metallica.com/songs/last-caress.html;I got something to say,I killed your baby today,And it doesn’t matter much to me,As long as it’s dead, ,I got something to say,I raped your mother today,And it doesn’t matter much to me,As long as she’s spread, ,Sweet lovely death,Just waiting for your breath,Come sweet death one last caress, ,Sweet lovely death,Just waiting for your breath,Come sweet death one last caress, ,I got something to say,I killed your baby today,And it doesn’t matter much to me,As long as it’s dead, ,Sweet lovely death,Just waiting for your breath,Come sweet death one last caress
Last Caress/Green Hell;The Misfits;Glenn Danzig;3:30;The $5.98 E.P. – Garage Days Re-Revisited;Covers EP;5;1987-08-21;https://www.metallica.com/songs/last-caress-green-hell.html;I got something to say,I killed your baby today,And it doesn’t matter much to me,As long as it’s dead, ,I got something to say,I raped your mother today,And it doesn’t matter much to me,As long as she’s spread, ,Sweet lovely death,Just waiting for your breath,Come sweet death one last caress, ,Sweet lovely death,Just waiting for your breath,Come sweet death one last caress, ,I got something to say,I killed your baby today,And it doesn’t matter much to me,As long as it’s dead, ,Sweet lovely death,Just waiting for your breath,Come sweet death one last caress, ,Here in this place lies the key to your death,Touch it see it, ,Here in this place is a means to your end,Touch it feel it,Green hell, ,You’ve come to this like no one could,I bet you never knew you would,And don’t you run away from it,I bet you thought you really could, ,We’re gonna burn in hell,Green hell,Like every hell but kind of green,In hell green hell,We’re gonna face the mess we’re,In hell green hell,I think I’d rather be up here,In hell green hell,You know I fucking shake apart,In hell green hell,Gotta find a way that you will stay,Green hell,Cannot forget about the heat,In hell green hell,Hell is green I need a flame,In hell green hell, ,Gotta burn in hell,Green hell, ,You’ve come to this like no one could,I bet you never knew you would,And don’t you run from it,I bet you thought you really could, ,Here in this place is the key to your death,Touch it see it, ,Here in this place is a means to your end,Touch it feel it, ,You’ve come to this like no one could,I bet you never knew you would,And don’t you run away from anything,I bet you thought you really could,You’ve come to this like no one could,I bet you never knew you would,We’re gonna burn in Hell, ,Green hell
Leper Messiah;Metallica;James Hetfield,Lars Ulrich;5:40;Master of Puppets;Album;6;1986-03-03;https://www.metallica.com/songs/leper-messiah.html;Spineless from the start sucked into the part,Circus comes to town you play the lead clown,Please please,Spreading his disease living by his story,Knees knees,Falling to your knees suffer for his glory,You will, ,Time for lust time for lie,Time to kiss your life goodbye,Send me money send me green,Heaven you will meet,Make a contribution,And you’ll get the better seat,Bow to Leper Messiah, ,Marvel at his tricks Need your Sunday fix,Blind devotion came Rotting your brain,Chain chain,Join the endless chain taken by his glamour,Fame fame,Infection is the game stinking drunk with power,We see, ,Time for lust time for lie,Time to kiss your life goodbye,Send me money send me green,Heaven you will meet,Make a contribution,And you’ll get the better seat,Bow to Leper Messiah, ,Witchery weakening,Sees the sheep are gathering,Set the trap hypnotize,Now you follow, ,Time for lust time for lie,Time to kiss your life goodbye,Send me money send me green,Heaven you will meet,Make a contribution,And you’ll get the better seat, ,Lie
Let It Loose;Savage;Chris Bradley,Andy Dawson;;;;;;https://www.metallica.com/songs/let-it-loose.html;We won’t need to intimidate you,If we get a major breakthrough,So come on let it loose, ,You’ve all seen this all before,So come on get up and off of the floor, Let’s go let it loose, ,We’re not here to read your rights,Tonight’s the night you do what you like,Hey you there let it loose, ,If it’s much too loud well we don’t care,Are you ready let it loose, ,Going crazy, ,We’ve the goods to appetise,Take it all don’t compromise,Let it loose, ,Forget tomorrow we’re here today,Is it what you want are you here to stay,What do you say let it loose
Little Dog;Metallica;Lou Reed,James Hetfield,Lars Ulrich,Kirk Hammett,Robert Trujillo;8:00;Lulu;Collaborative;8;2011-10-31;https://www.metallica.com/songs/little-dog.html;Little dog who can’t get in,Moaning at the bed side,Moaning from each limb, ,Little dog who can’t get in,Can only cry but,Can not swim, ,Pony legs little trot,Little dog has to wait a lot, ,The bigger dog has got his spot,And elbowed him away, ,Listen to him barking,Listen to him call,Little dog don’t have much at all, ,A puny body and a tiny dick,A little dog can make you sick, ,If you got the money you can go to the top,The female dog don’t care what you got,As long as you can raise that,Little doggie face to a cold hearted pussy,You could have a taste, ,A taste of what the big dog got,A taste of what the big dog got,The little dog with the one hundred dollar spot,Can run his tongue over the hot in trot,Hot in trot,Run his tongue over the hot in trot, ,Money can do anything,Money can do anything,Money can do anything,Tell me what you want, ,My small dog he want what I got, ,Wants to run his tongue over my hot spot, ,Pathetic little dog, ,Pathetic little dog,The little man follows his nose,Counts his fingers and his toes,He still got those,Pathetic little dog,Pathetic little dog,Following his nose,But it needs my money to buy, ,I’m an up while you’re a down,I am an up while you’re a down,The spring and the will follow me around,While you sniff your shit in the wind,Sniff your shit in the wind,Money can do anything,Money can do anything,Tell me what it is you want,Just tell me what it is you want,I’m an up while you’re a down,The spring and the will follow me around, ,Tell me what it is you want,Tell me what it is you want, ,You sniff your shit in the wind,Follow me around, ,Pathetic little dog,Pathetic little dog,Pathetic little dog
London Dungeon;The Misfits;Glenn Danzig;;;;;;https://www.metallica.com/songs/london-dungeon.html;They called us walking corpses,Unholy living dead,They had to lock us up,Put us in their British hell, ,Make sure your face is clean now,Can’t have no dirty dead,All the corpses here are clean boy,All the yanks in British hell, ,I don’t wanna be here in your London Dungeon,I don’t wanna be here in your British hell,Ain’t no mystery why I’m in misery in Hell,Here’s hoping you’re free, ,They called us walking corpses,Unholy living dead,They had to lock us up,Put us in their British hell, ,I don’t wanna be here in your London Dungeon,I don’t wanna be here in your British hell,Ain’t no mystery why I’m in misery in Hell,Here’s hoping you’re swell, ,Make sure your face is clean now,Can’t have no dirty dead,All the corpses here are clean boy,All the yanks in British hell, ,I don’t wanna be here in your London Dungeon,I don’t wanna be here in your British hell,Ain’t no mystery why I’m in misery in Hell, ,Here’s hoping you’re swell,Here’s hoping you’re swell,Here’s hoping you’re swell,Here’s hoping you’re swell
Lords of Summer;Metallica;James Hetfield,Lars Ulrich,Robert Trujillo;8:21;Lords of Summer;Single;1;2014-06-20;https://www.metallica.com/songs/lords-of-summer.html;Sight,Pale riders into the night,Galloping harder and faster,Through your dreaming, ,Wake,Walk towards the fire innate,Frostbitten soul below zero,Excitation, ,Are you remembering the sound?,Recall the shaking of the ground?, ,Pounding,Pounding,No Remorse,Lords of summer set on course, ,Pushing,Pushing,Horsemen Ride,Lords of summer undenied, ,At last the thawing has begun,Come trade your darkness for the sun,Melting the chill of winter’s turn,So celebrate and let your fires burn,The Lords of Summer have returned , ,Straight,Light passes through penetrate,It’s been a long lonely winter,Illumination, ,Bright,Bathe in the volume and light,Reanimated by fire,Transformation, ,Become the nexus of the sound,Become the shaking of the ground, ,Pounding,Pounding,No Remorse,Lords of summer set on course, ,Pushing,Pushing,Horsemen Ride,Lords of summer undenied, ,At last the thawing has begun,Come trade your darkness for the sun,Melting the chill of winter’s turn,So celebrate and let your fires burn,The Lords of Summer have returned , ,Whoa Pounding,Pounding,No Remorse,Lords of summer set on course, ,Whoa Pushing,Pushing,Horsemen Ride,Lords of summer undenied,Undenied, ,At last the thawing has begun,Come trade your darkness for the sun,Melting the chill of winter’s turn,So celebrate and let your fires burn,The Lords of Summer have returned
Loverman;Nick Cave & the Bad Seeds;Nick Cave;7:53;Garage Inc.;Covers;6;1998-11-24;https://www.metallica.com/songs/loverman.html;There’s a devil waitin’ outside your door,(How much longer),There’s a devil waitin’ outside your door,(How much longer),It is bucking and braying and pawing at the floor,(How much longer),And he’s howling with pain and crawling up the walls,(How much longer), There’s a devil waitin’ outside your door,(How much longer),And he’s weak with evil and broken by the world,(How much longer),And he’s shouting your name and he’s asking for more,(How much longer),There’s a devil waiting outside your door,(How much longer), ,Loverman,Since the world began,Forever amen,’Til end of time,Take off that dress,I’m coming down,I’m your loverman,‘cause I am what I am what I am what I am what I am, ,L is for LOVE baby,O is for ONLY you that I do, V is for loving VIRTUALLY everything that you are,E is for loving almost EVERYTHING that you do,R is for RAPE me,M is for MURDER me,A is for ANSWERING all of my prayers,N is for KNOWING your loverman’s going to be the answer to all of yours, ,Loverman,’Til the bitter end,While empires burn down,Forever and ever and ever and ever ever amen,I’m your loverman,So help me baby,So help me baby,Cause I am what I am what I am what I am what I am,I’m your loverman, ,There’s a devil crawlin’ along your floor,(How much longer),There’s a devil crawlin’ along your floor,(How much longer),With a tremblin’ heart he’s coming through your door,(How much longer),With his straining sex in his jumping paw,(How much longer),There’s a devil crawlin’ along your floor,(How much longer), ,And he’s old and he’s stupid and he’s hungry and he’s sore,And he’s blind and he’s lame,And he’s dirty and he’s poor,Give me more give me more give me more give me more give me more,(How much longer),There’s a devil crawling along your floor,(How much longer), ,Loverman ha ha,And here I stand,Forever amen,‘cause I am what I am what I am what I am what I am,Hey forgive me baby,My hands are tied,And I got no choice no no no no I got no choice at all,No choice at all, ,I’ll say it again,L is for LOVE baby,O is for OH yes I do,V is for VIRTUE so I ain’t gonna hurt you,E is for EVEN if you want me to,R is for RENDER unto me baby,M is for that which is MINE and,A is for ANY old how darling and,N is for ANY old time, ,Loverman,I got a masterplan,To take off your dress,Yeah and be your man be your man,Seize the throne,Seize the mantle,Seize that crown,‘cause I am what I am what I am what I am what I am,I’m your loverman, ,There’s a devil laying by your side,(How much longer),There’s a devil laying by your side,(How much longer),You might think he’s asleep but look at his eyes,(How much longer),He wants you darlin’ to be his bride,(How much longer),Yeah there’s a devil lying by your side,(How much longer),Loverman,(How much longer)
Low Man’s Lyric;Metallica;James Hetfield,Lars Ulrich;7:36;Reload;Album;11;1997-11-18;https://www.metallica.com/songs/low-mans-lyric.html;My eyes seek reality,My fingers seek my veins,There’s a dog at your back step,He must come in from the rain, ,I fall ‘cause I’ve let go,The net below has rot away,So my eyes seek reality,And my fingers seek my veins, ,The trash fire is warm,But nowhere safe from the storm,And I can’t bear to see,What I’ve let me be,So wicked and worn, ,So as I write to you,Of what is done and to do,Maybe you’ll understand,And you won’t cry for this man,‘Cause low man is due, ,Please forgive me, ,My eyes seek reality,My fingers feel for faith,Touch clean with a dirty hand,I touch the clean to the waste, ,The trash fire is warm,But nowhere safe from the storm,And I can’t bear to see,What I’ve let me be,So wicked and worn, ,So as I write to you,Of what is done and to do,Maybe you’ll understand,And won’t cry for this man,‘Cause low man is due, ,Please forgive me, ,So low the sky is all I see,All I want from you is forgive me,So you bring this poor dog in from the rain,Though he just wants right back out again, ,And I cry to the alleyway,Confess all to the rain,But I lie lie straight to the mirror,The one I’ve broken to match my face, ,The trash fire is warm,But nowhere safe from the storm,And I can’t bear to see,What I’ve let me be,So wicked and worn, ,So as I write to you,Of what is done and to do,Maybe you’ll understand,And won’t cry for this man,‘Cause low man is due, ,Please forgive me, ,So low the sky is all I see,All I want from you is forgive me,So you bring this poor dog in from the rain,Though he just wants right back out again, ,My eyes seek reality,My fingers seek my veins
Lux Æterna;Metallica;James Hetfield,Lars Ulrich;3:22;72 Seasons;Album;6;2023-04-14;https://www.metallica.com/songs/lux-aeterna.html;Anticipation,In domination,A sea of hearts beat as one unified,Magnification,All generations,Approaching thunder awaiting the light, ,Full speed or nothing,Full speed or nothing, ,Lux Æterna,Lux Æterna, ,Exhilaration,Frenzied sensation,Kindred alliance connected inside,Commiseration,Sonic salvation,Cast out the demons that strangle your life, ,Full speed or nothing,Full speed or nothing, ,Lux Æterna,Lux Æterna,Lux Æterna, ,Emancipation,Kill isolation,Never alone for the feelings alike,Amplification,Lightning the nation,Never alive more,Than right here tonight, ,Full speed or nothing,Full speed or nothing, ,Lux Æterna,Lux Æterna, ,Light it
Mama Said;Metallica;James Hetfield,Lars Ulrich;5:20;Load;Album;11;1996-06-04;https://www.metallica.com/songs/mama-said.html;Mama she has taught me well,Told me when I was young,Son your life’s an open book,Don’t close it ’fore it’s done,The brightest flame burns quickest,That’s what I heard her say,A son’s heart’s owed to mother,But I must find my way, ,Let my heart go,Let your son grow,Mama let my heart go,Or let this heart be still, ,“Rebel” my new last name,Wild blood in my veins,Apron strings around my neck,The mark that still remains,I left home at an early age,Of what I heard was wrong,I never asked forgiveness,But what is said is done, ,Let my heart go,Let your son grow,Mama let my heart go,Or let this heart be still, ,Never I ask of you,But never I gave,But you gave me your emptiness,I now take to my grave,Never I ask of you,But never I gave,But you gave me your emptiness,I now take to my grave,So let this heart be still, ,Mama now I’m coming home,I’m not all you wished of me,A mother’s love for her son,Unspoken help me be,I took your love for granted,And all the things you said to me,I need your arms to welcome me,But a cold stone’s all I see, ,Let my heart go,Let your son grow,Mama let my heart go,Or let this heart be still, ,Let my heart go,Mama let my heart go,You never let my heart go,So let this heart be still, ,Never I ask of you,But never I gave,But you gave me your emptiness,I now take to my grave,Never I ask of you,But never I gave,But you gave me your emptiness,I now take to my grave,So let this heart be still
ManUNKind;Metallica;James Hetfield,Lars Ulrich,Robert Trujillo;6:55;Hardwired... to Self-Destruct;Album;8;2016-11-18;https://www.metallica.com/songs/manunkind.html;Chaos,Awaiting for Adams return,Madness,Smiling as we watch it burn, ,I’ve become, ,Hostage to my mind,Left myself behind,Blind lead blind,Quest to find,Faith in man(un)kind, ,Garden,Of Eden so simple and pure,Greedy,Needy must we have more, ,I’ve become, ,Hostage to my mind,Left myself behind,Blind lead blind,Quest to find,Faith in man(un)kind, ,Fascinate,Partner of insanity,Decimate,Lessons we never learn, ,Dominate,Killing of the innocence,Deviate,And to dust you return,Yeah, ,Seized by the day,Frozen captive by the night,Seized by the day,All the dark days of your life, ,Seized by the day,Frozen captive by the night,Led so astray,All the dark days of your life, ,Zero,Reset creation of man,Foolish,Ready to witness again?, ,I’ve become, ,Hostage to my mind,Left myself behind,Blind lead blind,Quest to find,Faith in man(un)kind, ,Faith in man(un)kind,Oh Faith in man(un)kind,Faith in man(un)kind,Oh Faith in man(un)kind
Master of Puppets;Metallica;James Hetfield,Lars Ulrich,Cliff Burton,Kirk Hammett;8:36;Master of Puppets;Album;2;1986-03-03;https://www.metallica.com/songs/master-of-puppets.html;End of passion play crumbling away,I’m your source of self-destruction,Veins that pump with fear sucking darkest clear,Leading on your death’s construction,Taste me you will see,More is all you need,You’re dedicated to,How I’m killing you, ,Come crawling faster,Obey your master,Your life burns faster,Obey your master,Master, ,Master of puppets I’m pulling your strings,Twisting your mind and smashing your dreams,Blinded by me you can’t see a thing,Just call my name ‘cause I’ll hear you scream,Master,Master,Just call my name ‘cause I’ll hear you scream,Master,Master, ,Needlework the way never you betray,Life of death becoming clearer,Pain monopoly ritual misery,Chop your breakfast on a mirror,Taste me you will see,More is all you need,You’re dedicated to,How I’m killing you, ,Come crawling faster,Obey your master,Your life burns faster,Obey your master,Master, ,Master of puppets I’m pulling your strings,Twisting your mind and smashing your dreams,Blinded by me you can’t see a thing,Just call my name ‘cause I’ll hear you scream,Master,Master,Just call my name ‘cause I’ll hear you scream,Master,Master, ,Master master,Where’s the dreams that I’ve been after?,Master master,You promised only lies,Laughter laughter,All I hear or see is laughter,Laughter laughter,Laughing at my cries, ,Fix me, ,Hell is worth all that natural habitat,Just a rhyme without a reason,Never-ending maze drift on numbered days,Now your life is out of season,I will occupy,I will help you die,I will run through you,Now I rule you too, ,Come crawling faster,Obey your master,Your life burns faster,Obey your master,Master, ,Master of puppets I’m pulling your strings,Twisting your mind and smashing your dreams,Blinded by me you can’t see a thing,Just call my name ‘cause I’ll hear you scream,Master,Master,Just call my name ‘cause I’ll hear you scream,Master,Master
